{
  "status": "blocked",
  "missing_capabilities": [
    "paper_read_sections"
  ],
  "sources": [
    {
      "source_id": "fixture:scope-1",
      "kind": "user",
      "locator": "Synthetic example question; not a real paper or executed search",
      "access": "user_input"
    }
  ],
  "limitations": [
    "Synthetic example: required capability is unavailable; no research operation was performed."
  ],
  "evidence_ids": [],
  "claims": [],
  "method_draft": null,
  "reading_route": []
}
